{
  "schemaVersion": "1.0.0",
  "instanceId": "33333333-3333-4333-8333-333333333333",
  "projectName": "FixtureLibrary",
  "projectType": "library",
  "sourceRoots": ["src"],
  "entryFiles": ["README.md"],
  "testCommands": ["library-test"],
  "protectedPaths": ["src"],
  "additionalContextFiles": [],
  "ignorePatterns": ["dist/**"],
  "workstreamStaleDays": 30
}
