{
  "schemaVersion": "1.0.0",
  "instanceId": "11111111-1111-4111-8111-111111111111",
  "projectName": "FixtureUnity",
  "projectType": "unity",
  "sourceRoots": ["Assets/Scripts"],
  "entryFiles": ["ProjectSettings/ProjectVersion.txt"],
  "testCommands": ["context-check"],
  "protectedPaths": ["Assets"],
  "additionalContextFiles": [],
  "ignorePatterns": ["Library/**"],
  "workstreamStaleDays": 14
}
