{
  "schemaVersion": "1.0.0",
  "instanceId": "22222222-2222-4222-8222-222222222222",
  "projectName": "FixtureWeb",
  "projectType": "web",
  "sourceRoots": ["src"],
  "entryFiles": ["package.json"],
  "testCommands": ["npm test"],
  "protectedPaths": ["src"],
  "additionalContextFiles": [],
  "ignorePatterns": ["node_modules/**"],
  "workstreamStaleDays": 14
}
